{
  "schema_version": "extraction.v2",
  "call_id": "call-fixture-08",
  "extracted_at": "2025-12-20T00:00:00.000Z",
  "confidence_overall": 0.7,
  "incident_type": "chest pain",
  "priority": "Priority 1",
  "jurisdiction": null,
  "channel": null,
  "talkgroup": null,
  "units": [],
  "incident_id": null,
  "address_raw": "200 Elm St",
  "address_normalized": "200 Elm St",
  "cross_street_1": null,
  "cross_street_2": null,
  "landmark": null,
  "city": null,
  "notes": null,
  "field_confidence": {
    "incident_type": 0.85,
    "priority": 0.85,
    "jurisdiction": 0.1,
    "channel": 0.1,
    "talkgroup": 0.1,
    "units": 0.1,
    "incident_id": 0.1,
    "address_raw": 0.85,
    "address_normalized": 0.8,
    "cross_street_1": 0.1,
    "cross_street_2": 0.1,
    "landmark": 0.1,
    "city": 0.1,
    "notes": 0.1
  },
  "evidence": {
    "incident_type": [
      {
        "text": "chest pain",
        "start_char": 31,
        "end_char": 41,
        "reason": "explicitly stated"
      }
    ],
    "priority": [
      {
        "text": "Priority 1",
        "start_char": 0,
        "end_char": 10,
        "reason": "explicitly stated"
      }
    ],
    "jurisdiction": [],
    "channel": [],
    "talkgroup": [],
    "units": [],
    "incident_id": [],
    "address_raw": [
      {
        "text": "200 Elm St",
        "start_char": 19,
        "end_char": 29,
        "reason": "explicitly stated"
      }
    ],
    "address_normalized": [
      {
        "text": "200 Elm St",
        "start_char": 19,
        "end_char": 29,
        "reason": "normalized from transcript"
      }
    ],
    "cross_street_1": [],
    "cross_street_2": [],
    "landmark": [],
    "city": [],
    "notes": []
  }
}