{
  "schema_version": "extraction.v2",
  "call_id": "call-fixture-05",
  "extracted_at": "2025-12-20T00:00:00.000Z",
  "confidence_overall": 0.7,
  "incident_type": "medical assistance",
  "priority": null,
  "jurisdiction": null,
  "channel": null,
  "talkgroup": null,
  "units": [],
  "incident_id": null,
  "address_raw": null,
  "address_normalized": null,
  "cross_street_1": null,
  "cross_street_2": null,
  "landmark": null,
  "city": null,
  "notes": null,
  "field_confidence": {
    "incident_type": 0.8,
    "priority": 0.1,
    "jurisdiction": 0.1,
    "channel": 0.1,
    "talkgroup": 0.1,
    "units": 0.1,
    "incident_id": 0.1,
    "address_raw": 0.1,
    "address_normalized": 0.1,
    "cross_street_1": 0.1,
    "cross_street_2": 0.1,
    "landmark": 0.1,
    "city": 0.1,
    "notes": 0.1
  },
  "evidence": {
    "incident_type": [
      {
        "text": "medical assistance",
        "start_char": 25,
        "end_char": 43,
        "reason": "explicitly stated"
      }
    ],
    "priority": [],
    "jurisdiction": [],
    "channel": [],
    "talkgroup": [],
    "units": [],
    "incident_id": [],
    "address_raw": [],
    "address_normalized": [],
    "cross_street_1": [],
    "cross_street_2": [],
    "landmark": [],
    "city": [],
    "notes": []
  }
}